[
  {
    "id": "kb-orders-cancel-01",
    "topic": "orders",
    "keywords_msa": [
      "إلغاء الطلب",
      "إلغاء طلبية",
      "كيف ألغي طلبي",
      "هل يمكن إلغاء الطلب",
      "لم يُشحن بعد"
    ],
    "keywords_egy": [
      "ألغي الأوردر",
      "أكنسل الطلب",
      "ازاي ألغي طلبي",
      "ينفع ألغي الأوردر",
      "cancel el order",
      "elgha2 order"
    ],
    "wording_msa": "يمكنك إلغاء طلبك مجاناً ما دام لم يُشحن بعد. ادخل إلى صفحة \"طلباتي\" في حسابك، اختر الطلب المطلوب، ثم اضغط على \"إلغاء الطلب\". إن كان الطلب قد شُحن بالفعل، فستحتاج إلى استخدام إجراء الإرجاع بعد استلامه.",
    "wording_egy": "تقدر تلغي الأوردر بتاعك مجاناً طول ما لسه ما اتشحنش. ادخل على صفحة \"طلباتي\" في حسابك، اختار الأوردر اللي عايز تلغيه، ودوس على \"إلغاء الطلب\". لو الأوردر اتشحن خلاص، هتحتاج تستعمل خطوات الإرجاع بعد ما توصلك الشحنة.",
    "source": "internal FAQ seed v1",
    "last_updated": "2026-05-04"
  },
  {
    "id": "kb-orders-track-01",
    "topic": "orders",
    "keywords_msa": [
      "تتبع الطلب",
      "أين طلبي",
      "حالة الطلب",
      "متابعة الطلب",
      "تتبع الشحنة"
    ],
    "keywords_egy": [
      "اتابع الأوردر",
      "الأوردر فين",
      "حالة الأوردر",
      "track el order",
      "fen el order",
      "متابعة الأوردر"
    ],
    "wording_msa": "يمكنك متابعة طلبك من صفحة \"طلباتي\" في حسابك بالضغط على رقم الطلب. ستظهر لك الحالة الحالية (قيد المعالجة، قيد الشحن، تم التسليم) ورقم تتبع شركة الشحن إن كان قد شُحن، إلى جانب رابط مباشر لصفحة تتبع الشركة الناقلة.",
    "wording_egy": "تقدر تتابع الأوردر بتاعك من صفحة \"طلباتي\" في حسابك، اضغط على رقم الأوردر. هتظهرلك الحالة الحالية (تحت المعالجة، اتشحن، اتسلم) ورقم تتبع شركة الشحن لو الأوردر اتشحن خلاص، وكمان لينك مباشر لصفحة التتبع بتاعت شركة الشحن.",
    "source": "internal FAQ seed v2",
    "last_updated": "2026-05-04"
  },
  {
    "id": "kb-orders-modify-items-01",
    "topic": "orders",
    "keywords_msa": [
      "تعديل الطلب",
      "إضافة منتج للطلب",
      "إزالة منتج من الطلب",
      "تغيير محتويات الطلب",
      "تعديل عناصر الطلب"
    ],
    "keywords_egy": [
      "أعدل الأوردر",
      "أضيف حاجة للأوردر",
      "أشيل حاجة من الأوردر",
      "أغير محتويات الأوردر",
      "edit el order",
      "تعديل محتويات الأوردر"
    ],
    "wording_msa": "للأسف لا يمكن تعديل محتويات الطلب بعد إتمامه. يمكنك إلغاء الطلب الحالي ما دام لم يُشحن بعد، ثم إنشاء طلب جديد بالمحتويات المطلوبة. ادخل على \"طلباتي\" واختر الطلب لإلغائه ثم أعد إتمام الشراء.",
    "wording_egy": "للأسف ما تقدرش تعدل محتويات الأوردر بعد ما تعمله. لو الأوردر لسه ما اتشحنش، تقدر تلغيه وتعمل أوردر جديد بالحاجات اللي عايزها. ادخل على \"طلباتي\" واختار الأوردر عشان تلغيه وبعدين اعمل الأوردر تاني.",
    "source": "internal FAQ seed v2",
    "last_updated": "2026-05-04"
  },
  {
    "id": "kb-orders-status-01",
    "topic": "orders",
    "keywords_msa": [
      "ما معنى قيد المعالجة",
      "حالات الطلب",
      "معنى تم الشحن",
      "ما هي حالة الطلب",
      "حالة قيد التجهيز"
    ],
    "keywords_egy": [
      "يعني إيه قيد المعالجة",
      "حالات الأوردر",
      "يعني إيه اتشحن",
      "إيه معنى الحالة",
      "بتجهز يعني إيه"
    ],
    "wording_msa": "تمر الطلبات بالحالات التالية: \"قيد المعالجة\" (تم استلام طلبك ويُجهَّز للشحن)، \"قيد الشحن\" (المنتج خرج من المخزن إلى شركة التوصيل)، \"تم التسليم\" (وصل إليك)، و\"أُلغي\" (تم إلغاء الطلب). يمكنك رؤية الحالة الحالية في صفحة \"طلباتي\".",
    "wording_egy": "الأوردر بيمر بالحالات دي: \"تحت المعالجة\" (احنا استلمنا الأوردر وبنحضره للشحن)، \"اتشحن\" (المنتج طلع من المخزن لشركة التوصيل)، \"اتسلم\" (وصلك خلاص)، و\"اتلغى\" (الأوردر اتلغى). تقدر تشوف الحالة الحالية في صفحة \"طلباتي\".",
    "source": "internal FAQ seed v2",
    "last_updated": "2026-05-04"
  },
  {
    "id": "kb-returns-policy-01",
    "topic": "returns",
    "keywords_msa": [
      "سياسة الإرجاع",
      "كيف أرجع المنتج",
      "إرجاع طلب",
      "مدة الإرجاع",
      "هل يمكن الإرجاع"
    ],
    "keywords_egy": [
      "سياسة المرتجعات",
      "ازاي ارجع المنتج",
      "ارجع الأوردر",
      "كام يوم ارجع فيهم",
      "return el order",
      "irga3 el mantag"
    ],
    "wording_msa": "يمكنك إرجاع أي منتج خلال 14 يوماً من تاريخ الاستلام، شرط أن يكون بحالته الأصلية وغلافه سليم. لبدء الإرجاع، ادخل على \"طلباتي\"، اختر الطلب، ثم اضغط على \"طلب إرجاع\". سيتم رد المبلغ خلال 5–7 أيام عمل بعد استلامنا للمنتج.",
    "wording_egy": "تقدر ترجع أي منتج خلال 14 يوم من يوم ما توصلك الشحنة، بشرط يكون بحالته الأصلية وعلبته سليمة. عشان تبدأ الإرجاع ادخل على \"طلباتي\"، اختار الأوردر، ودوس على \"طلب إرجاع\". المبلغ بترجعهولك في خلال 5 لـ 7 أيام شغل بعد ما يوصلنا المنتج.",
    "source": "internal FAQ seed v1",
    "last_updated": "2026-05-04"
  },
  {
    "id": "kb-returns-defective-01",
    "topic": "returns",
    "keywords_msa": [
      "منتج معيب",
      "منتج تالف",
      "منتج لا يعمل",
      "إرجاع منتج معيب",
      "استبدال منتج تالف"
    ],
    "keywords_egy": [
      "منتج عطلان",
      "منتج باظ",
      "منتج مش شغال",
      "ارجع منتج عطلان",
      "استبدل منتج باظ"
    ],
    "wording_msa": "إن وصلك منتج معيب أو لا يعمل، تواصل معنا خلال 48 ساعة من الاستلام عبر صفحة \"طلباتي\" واضغط على \"الإبلاغ عن مشكلة\". سنرتب لك إرجاعاً مجانياً واستبدالاً للمنتج أو رد المبلغ كاملاً، حسب رغبتك. تكلفة شحن الإرجاع علينا في هذه الحالة.",
    "wording_egy": "لو وصلك منتج عطلان أو مش شغال، كلمنا في خلال 48 ساعة من ما توصلك الشحنة من صفحة \"طلباتي\" ودوس على \"الإبلاغ عن مشكلة\". هنرتب ليك إرجاع مجاني وإما نبدل المنتج أو نرجعلك المبلغ كامل، زي ما تحب. تكلفة شحن الإرجاع علينا في الحالة دي.",
    "source": "internal FAQ seed v2",
    "last_updated": "2026-05-04"
  },
  {
    "id": "kb-returns-exchange-01",
    "topic": "returns",
    "keywords_msa": [
      "استبدال منتج",
      "تبديل منتج",
      "تغيير مقاس",
      "استبدال بدلاً من الإرجاع",
      "تغيير لون المنتج"
    ],
    "keywords_egy": [
      "أبدل منتج",
      "أغير المقاس",
      "أستبدل بدل ما أرجع",
      "أغير اللون",
      "exchange el mantag"
    ],
    "wording_msa": "يمكنك استبدال المنتج خلال 14 يوماً من الاستلام بنفس شروط الإرجاع (الحالة الأصلية، الغلاف سليم). من \"طلباتي\" اختر الطلب ثم \"طلب استبدال\"، وحدد المنتج البديل المطلوب. ستُحسب أي فروق في السعر بإيجاب أو سلب على المبلغ النهائي.",
    "wording_egy": "تقدر تبدل المنتج خلال 14 يوم من ما توصلك الشحنة بنفس شروط الإرجاع (بحالته الأصلية والعلبة سليمة). من \"طلباتي\" اختار الأوردر ودوس \"طلب استبدال\" وحدد المنتج البديل اللي عايزه. لو فيه فرق في السعر هتدفعه أو نرجعهولك مع المبلغ النهائي.",
    "source": "internal FAQ seed v2",
    "last_updated": "2026-05-04"
  },
  {
    "id": "kb-returns-shipping-cost-01",
    "topic": "returns",
    "keywords_msa": [
      "تكلفة شحن الإرجاع",
      "من يدفع شحن الإرجاع",
      "هل الإرجاع مجاني",
      "رسوم الإرجاع",
      "تكلفة إرجاع المنتج"
    ],
    "keywords_egy": [
      "تكلفة شحن الإرجاع",
      "مين بيدفع الشحن",
      "الإرجاع مجاني ولا لأ",
      "رسوم الإرجاع",
      "بكام الإرجاع"
    ],
    "wording_msa": "تكلفة شحن الإرجاع مجانية إذا كان السبب من جانبنا (منتج معيب، خطأ في الشحن، مقاس خاطئ من اختيارنا). أما إذا كان الإرجاع لتغيير الرأي، فسيُخصم 30 جنيهاً من المبلغ المستحقّ ردّه لتغطية شحنة الإرجاع.",
    "wording_egy": "شحن الإرجاع مجاني لو السبب من عندنا (منتج عطلان، غلطة في الشحن، مقاس غلط من اختيارنا). لكن لو بترجع المنتج عشان غيرت رأيك، هيتخصم 30 جنيه من المبلغ اللي هيرجعلك عشان تكلفة شحن الإرجاع.",
    "source": "internal FAQ seed v2",
    "last_updated": "2026-05-04"
  },
  {
    "id": "kb-shipping-times-01",
    "topic": "shipping",
    "keywords_msa": [
      "مدة الشحن",
      "كم تستغرق الشحنة",
      "متى يصلني الطلب",
      "وقت التوصيل",
      "تأخر الطلب"
    ],
    "keywords_egy": [
      "الشحن بياخد قد ايه",
      "الأوردر هيوصل امتى",
      "وقت التوصيل",
      "الشحنة اتأخرت",
      "shipping kam yom",
      "el order tawel"
    ],
    "wording_msa": "تستغرق الشحنة المعتادة من 2 إلى 5 أيام عمل داخل القاهرة والإسكندرية، ومن 3 إلى 7 أيام عمل في باقي المحافظات. يمكنك متابعة حالة الشحنة من صفحة \"طلباتي\" بالضغط على رقم الطلب. إن تأخرت الشحنة عن المدة المتوقعة، تواصل معنا لنفحص حالتها.",
    "wording_egy": "الشحن بياخد عادةً من 2 لـ 5 أيام شغل في القاهرة والإسكندرية، ومن 3 لـ 7 أيام شغل في باقي المحافظات. تقدر تتابع الشحنة من صفحة \"طلباتي\" بالضغط على رقم الأوردر. لو الشحنة اتأخرت عن المدة دي، كلمنا وهنشوف حالتها.",
    "source": "internal FAQ seed v1",
    "last_updated": "2026-05-04"
  },
  {
    "id": "kb-shipping-international-01",
    "topic": "shipping",
    "keywords_msa": [
      "الشحن الدولي",
      "الشحن خارج مصر",
      "هل تشحنون للخارج",
      "التوصيل لدول الخليج",
      "الشحن للسعودية"
    ],
    "keywords_egy": [
      "الشحن لبره",
      "بتشحنوا برة مصر",
      "التوصيل للسعودية",
      "الشحن للخليج",
      "شحن الإمارات"
    ],
    "wording_msa": "حالياً نقتصر على الشحن داخل مصر فقط ولا نوفر شحناً دولياً. نعمل على إضافة الشحن إلى دول الخليج خلال الأشهر القادمة. للاطلاع على آخر التحديثات، تابعنا على وسائل التواصل الاجتماعي.",
    "wording_egy": "احنا دلوقتي بنشحن جوه مصر بس وما عندناش شحن دولي. بنشتغل على إضافة الشحن لدول الخليج في الشهور الجاية. تابعنا على السوشيال ميديا عشان تعرف آخر الأخبار.",
    "source": "internal FAQ seed v2",
    "last_updated": "2026-05-04"
  },
  {
    "id": "kb-shipping-cost-01",
    "topic": "shipping",
    "keywords_msa": [
      "تكلفة الشحن",
      "رسوم التوصيل",
      "كم سعر الشحن",
      "هل الشحن مجاني",
      "تكلفة التوصيل"
    ],
    "keywords_egy": [
      "كم الشحن",
      "كم التوصيل",
      "الشحن بكام",
      "الشحن مجاني ولا",
      "تكلفة الشحن"
    ],
    "wording_msa": "تكلفة الشحن داخل القاهرة والإسكندرية 30 جنيهاً، ولباقي المحافظات 50 جنيهاً. الشحن مجاني للطلبات التي تتجاوز قيمتها 1000 جنيه. ستظهر تكلفة الشحن النهائية أمامك عند إتمام عملية الدفع.",
    "wording_egy": "الشحن في القاهرة والإسكندرية بـ30 جنيه، وفي باقي المحافظات بـ50 جنيه. الشحن مجاني للأوردرات اللي قيمتها فوق الـ1000 جنيه. تكلفة الشحن هتظهرلك قبل ما تدفع.",
    "source": "internal FAQ seed v2",
    "last_updated": "2026-05-04"
  },
  {